"Assateague State Park","Worcester County","","",""
"","","","",""
"Cunningham Falls State Park","Frederick County","","",""
"Deep Creek State Park","Garrett County","","",""
"","","","",""
"Gunpowder Falls State Park","Baltimore County","","",""
"Herrington Manor State Park","Garrett County","","",""
"Janes Island State Park","Somerset County","","",""
"Martinak State Park","Caroline County","","",""
"","","","",""
"Patapsco Valley State Park","Baltimore County","","",""
"Pocomoke State Park","Worcester County","","",""
"Point Lookout State Park","St . Mary&apos;s County","","",""
"Rocky Gap State Park","Allegany County","","",""
"Sandy Point State Park","Anne Arundel County","","",""
"Smallwood State Park","Charles County","","",""

