"Preceding station","Historical railways","Following station"
"Station","","Glasgow and South Western Railway Line Name","","Station"
"Station","","Caledonian Railway Line Name","","Station"
"Station","","Caledonian and Glasgow & South Western Railways Line Name","","Station"
"Station","","British Rail Line Name","","Station"
"Station","","London, Midland and Scottish Railway Line Name","","Station"
"Station","","London and North Eastern Railway Line Name","","Station"
"Station","","North British Railway Line Name","","Station"
"Station","","Caledonian and North British Railways Line Name","","Station"

